{
  "schema_version": "1.11",
  "tool": "evoguard",
  "tool_version": "4.3.0",
  "verdict": "PASS",
  "passed": true,
  "exit_code": 0,
  "reason_code": "tests_passed",
  "reason": "the black-box pack passed (2/2) \u2014 the candidate satisfied the judge-owned protocol tests, judged from outside its own process",
  "files_changed": [
    "CHANGELOG.md",
    "PROJECT_STATUS.json",
    "README.md",
    "ROADMAP.md",
    "SECURITY.md",
    "docs/GITHUB_ARTIFACT_ATTESTATIONS.md",
    "docs/PROJECT_STATUS.md",
    "docs/RELEASE_STATUS.md",
    "docs/SBOM.md",
    "docs/architecture/REFACTOR_PROGRAM.md",
    "evoom_guard/__init__.py"
  ],
  "protected_violations": [],
  "risk_level": "high",
  "risk_score": 0.84,
  "tests_passed": 2,
  "tests_total": 2,
  "test_command_ran": true,
  "execution_state": "completed",
  "execution_phase": "blackbox_pack",
  "verdict_source": "blackbox",
  "isolation": "docker",
  "source": "base/head",
  "base_reconstruction": null,
  "assurance": {
    "execution_state": "completed",
    "execution_phase": "blackbox_pack",
    "harness_integrity": "pre_gate_enforced",
    "report_integrity": "external_process_isolated",
    "candidate_isolation": "docker",
    "suite_isolation": "docker",
    "setup_isolation": null,
    "runtime_continuity": "not_applicable",
    "verifier_pack": {
      "configured": true,
      "present": true,
      "integrity": "verified_snapshot_pre_post",
      "identity_verified": true,
      "execution_state": "completed",
      "secrecy": "unmounted_from_candidate",
      "snapshot_sha256": "c129b33d647767db647906684fbfcc2ba834592a28b74ce4f02009984623ef43"
    },
    "repo_native_suite": "not_required_blackbox_only",
    "overall_profile": "black_box_external_judge",
    "note": "The black-box phase has external_process_isolated report integrity: its judge-owned pytest does not import the candidate, so candidate report/exit forgery cannot reach that phase. The black-box phase is the only required report channel. candidate_isolation is what was OBSERVED during a launcher invocation ('docker'); preparing 'docker' alone is not evidence. A container boundary also removes the pack from the candidate's reach. See docs/BLACKBOX.md."
  },
  "diff_coverage": null,
  "baseline": null,
  "attestation": {
    "created_utc": "2026-08-13T15:14:23Z",
    "guard_version": "4.3.0",
    "mode": "blackbox",
    "candidate_sha256": "bd1c51a955072b5190083559b32413abce345732194ae4e11d5752b6ba65a9c4",
    "deleted_paths": [],
    "test_command": "default:python -m pytest",
    "effective_policy": {
      "mode": "blackbox",
      "isolation": "docker",
      "docker_image": "python:3.12-slim@sha256:57cd7c3a7a273101a6485ba99423ee568157882804b1124b4dd04266317710de",
      "docker_network": "none",
      "test_command": "default:python -m pytest",
      "setup_command": null,
      "trust_setup_on_host": false,
      "setup_output_globs": [],
      "protected": [
        "*",
        ".evoguard.json",
        ".github/CODEOWNERS",
        ".github/workflows/*",
        "LICENSE",
        "NOTICE",
        "evidence/release-ledgers/*",
        "security/*.lock",
        "security/release-ledger-roots/*",
        "security/release-pipeline-bootstrap.json",
        "security/release-source-pack/*"
      ],
      "allow": [
        "CHANGELOG.md",
        "PROJECT_STATUS.json",
        "README.md",
        "ROADMAP.md",
        "SECURITY.md",
        "docs/GITHUB_ARTIFACT_ATTESTATIONS.md",
        "docs/PROJECT_STATUS.md",
        "docs/RELEASE_STATUS.md",
        "docs/SBOM.md",
        "docs/architecture/REFACTOR_PROGRAM.md",
        "evoom_guard/__init__.py"
      ],
      "allow_new_tests": false,
      "timeout": 300,
      "mem_limit_mb": 1024,
      "verifier_pack_required": true,
      "expect_verifier_pack_sha256": "c129b33d647767db647906684fbfcc2ba834592a28b74ce4f02009984623ef43",
      "blackbox": true,
      "blackbox_only": true,
      "require_report_integrity": "external_process_isolated",
      "require_candidate_isolation": "docker",
      "min_diff_coverage": null,
      "baseline_evidence": false,
      "require_demonstrated_fix": false,
      "strict_harness": false,
      "policy_id": "evoom-guard-protected-release-source",
      "policy_version": "2"
    },
    "policy_sha256": "7a9e92aa27949c962066b089046892bda4bf26891ee1b3ac49b411a825dc61a9",
    "junit_sha256": "0035e5d1315ed90ba7cf8dc62872267af6d34df6aea37aece5209977b266ac7d",
    "junit_digest_format": "JUNIT_XML_SHA256",
    "verifier_pack_sha256": "c129b33d647767db647906684fbfcc2ba834592a28b74ce4f02009984623ef43",
    "verifier_pack_manifest": {
      "id": "evoom-guard-release-source-protocol",
      "version": "1.0.1",
      "description": "Judge-owned release CLI and deterministic asset protocol for EvoOM Guard protected source admission",
      "target_type": "cli"
    },
    "verifier_pack_tests_passed": 2,
    "verifier_pack_tests_total": 2,
    "verifier_pack_junit_sha256": "0035e5d1315ed90ba7cf8dc62872267af6d34df6aea37aece5209977b266ac7d",
    "verifier_pack_junit_digest_format": "JUNIT_XML_SHA256",
    "verifier_pack_digest_format": "EVOGUARD_PACK_V2",
    "isolation_evidence": {
      "requested": "docker",
      "delivered": "docker",
      "image": "python:3.12-slim@sha256:57cd7c3a7a273101a6485ba99423ee568157882804b1124b4dd04266317710de",
      "image_digest": "sha256:25c5b8011a3425a140bf5fa73be0feabd3c0d5b323eecb19dc02437a368ae075",
      "network": "none",
      "runtime": null,
      "note": "candidate launcher prepared a network-less, read-only container; the repo copy is mounted read-only and the judge-owned pack is not mounted. A launcher receipt plus runtime-written CID is required before assurance can claim the container boundary was invoked.",
      "candidate_launcher_events": 2,
      "candidate_container_ids_observed": 2,
      "candidate_invocations": 2,
      "candidate_launcher_invocation_observed": true,
      "candidate_invocation_evidence_note": "proves the trusted pack invoked EVOGUARD_EXEC; it does not by itself prove that the pack-supplied argv exercised candidate code. Only the zero/nonzero fact is security-relevant; same-host code could discover the sidecar after its first invocation, so the raw receipt count is not an audited exact call count"
    },
    "setup_isolation_evidence": null,
    "repo_suite_isolation_evidence": null,
    "verifier_pack_isolation_evidence": null,
    "blackbox_pack_isolation_evidence": {
      "requested": "docker",
      "delivered": "docker",
      "image": "python:3.12-slim@sha256:57cd7c3a7a273101a6485ba99423ee568157882804b1124b4dd04266317710de",
      "image_digest": "sha256:25c5b8011a3425a140bf5fa73be0feabd3c0d5b323eecb19dc02437a368ae075",
      "network": "none",
      "runtime": null,
      "note": "candidate launcher prepared a network-less, read-only container; the repo copy is mounted read-only and the judge-owned pack is not mounted. A launcher receipt plus runtime-written CID is required before assurance can claim the container boundary was invoked.",
      "candidate_launcher_events": 2,
      "candidate_container_ids_observed": 2,
      "candidate_invocations": 2,
      "candidate_launcher_invocation_observed": true,
      "candidate_invocation_evidence_note": "proves the trusted pack invoked EVOGUARD_EXEC; it does not by itself prove that the pack-supplied argv exercised candidate code. Only the zero/nonzero fact is security-relevant; same-host code could discover the sidecar after its first invocation, so the raw receipt count is not an audited exact call count"
    },
    "deleted_paths_applied": [],
    "repo_suite_junit_sha256": null,
    "repo_suite_junit_digest_format": null,
    "repo_suite_tests_passed": null,
    "repo_suite_tests_total": null,
    "repo_suite_verdict_source": null,
    "repo_suite_returncode": null,
    "repo_suite_passed": null,
    "repo_suite_started": false,
    "repo_suite_completed": false,
    "repo_suite_state": "not_required_blackbox_only",
    "repo_suite_image_digest": null,
    "base_sha": "efb14217171138aacd4597dface4ca8517b0aebb",
    "head_sha": "d65f25f386fe6f4646ea8dd3cbbe1d5d889f73d4",
    "base_tree_sha": "ae5da3e76a99ba018e1cd0a68c8f5541b5178b04",
    "head_tree_sha": "71657b2bde83701c95b66b60f37be1580423ad32",
    "policy_id": "evoom-guard-protected-release-source",
    "policy_version": "2",
    "execution_state": "completed",
    "execution_phase": "blackbox_pack",
    "test_command_started": true,
    "delivered_isolation": "docker",
    "effective_candidate_isolation": "docker",
    "candidate_invocations": 2,
    "candidate_launcher_invocation_observed": true,
    "verifier_pack_present": true,
    "verifier_pack_started": true,
    "verifier_pack_completed": true,
    "setup_isolation": null,
    "runtime_tree_sha256": null,
    "runtime_tree_digest_format": null,
    "runtime_tree_entries": null,
    "runtime_tree_bytes": null,
    "runtime_identity_elapsed_ms": null,
    "runtime_continuity": null
  },
  "diagnostics": "..                                                                       [100%]\n2 passed in 3.76s\n\n"
}