{
  "schema_version": "1.11",
  "tool": "evoguard",
  "tool_version": "3.5.1",
  "verdict": "PASS",
  "passed": true,
  "exit_code": 0,
  "reason_code": "tests_passed",
  "reason": "all repo tests pass and the patch leaves the test harness untouched",
  "files_changed": [
    "charset_normalizer/models.py"
  ],
  "protected_violations": [],
  "risk_level": "low",
  "risk_score": 0.098,
  "tests_passed": 138,
  "tests_total": 138,
  "test_command_ran": true,
  "execution_state": "completed",
  "execution_phase": "repo_suite",
  "verdict_source": "junit+exit",
  "isolation": "subprocess",
  "source": "edit blocks",
  "base_reconstruction": null,
  "assurance": {
    "execution_state": "completed",
    "execution_phase": "repo_suite",
    "harness_integrity": "pre_gate_enforced",
    "report_integrity": "same_process_candidate_writable",
    "candidate_isolation": "subprocess",
    "suite_isolation": "subprocess",
    "setup_isolation": null,
    "runtime_continuity": "not_applicable",
    "verifier_pack": null,
    "overall_profile": "repo_native_same_process",
    "note": "report_integrity is same_process_candidate_writable: a determined in-process patch can forge the JUnit report and exit code together. Guard blocks the harness edits/deletions and stdout forgery agents do in practice; it does not stop deliberate process-level forgery in source. The container modes isolate the host, not the report. Use --blackbox for external_process_isolated. See docs/ASSURANCE.md."
  },
  "diff_coverage": null,
  "baseline": {
    "verdict": "FAIL",
    "tests_passed": 137,
    "tests_total": 138,
    "repair_effect": "demonstrated",
    "scope": "repo_suite_only",
    "note": "counterfactual suite-transition evidence, not a causal proof: the same judge and environment ran the REPO suite on the pristine base and on the candidate; 'demonstrated' means the base failed and the candidate passed. A verifier pack (if any) is exercised only on the candidate run \u2014 see scope."
  },
  "attestation": {
    "created_utc": "2026-07-14T16:49:13Z",
    "guard_version": "3.5.1",
    "mode": "repo",
    "candidate_sha256": "27fb8c4f418abf3511f2c95824db09c44856f4a3368711e5af141111870bc9df",
    "deleted_paths": [],
    "test_command": [
      "python",
      "-m",
      "pytest",
      "tests",
      "-q",
      "-o",
      "addopts=",
      "-p",
      "no:cacheprovider"
    ],
    "effective_policy": {
      "mode": "repo",
      "isolation": "subprocess",
      "docker_image": null,
      "docker_network": "none",
      "test_command": [
        "python",
        "-m",
        "pytest",
        "tests",
        "-q",
        "-o",
        "addopts=",
        "-p",
        "no:cacheprovider"
      ],
      "setup_command": null,
      "trust_setup_on_host": false,
      "setup_output_globs": [],
      "protected": [],
      "allow": [],
      "allow_new_tests": false,
      "timeout": 600,
      "mem_limit_mb": 1024,
      "verifier_pack_required": false,
      "expect_verifier_pack_sha256": null,
      "blackbox": false,
      "blackbox_only": false,
      "require_report_integrity": null,
      "require_candidate_isolation": null,
      "min_diff_coverage": null,
      "baseline_evidence": true,
      "require_demonstrated_fix": true,
      "policy_id": null,
      "policy_version": null
    },
    "policy_sha256": "349c2c0d8da098341f914c043722cf438116ae05f003b35b9edebe50519419a9",
    "junit_sha256": "6308c36d6ba6b05d6b5913ca86592e1374de3493ca02e308e4c303da5d35b23e",
    "junit_digest_format": "JUNIT_XML_SHA256",
    "verifier_pack_sha256": null,
    "verifier_pack_manifest": null,
    "verifier_pack_tests_passed": null,
    "verifier_pack_tests_total": null,
    "verifier_pack_digest_format": null,
    "isolation_evidence": null,
    "setup_isolation_evidence": null,
    "repo_suite_isolation_evidence": {
      "requested": "subprocess",
      "delivered": "subprocess",
      "image_digest": null,
      "network": null,
      "runtime": null
    },
    "verifier_pack_isolation_evidence": null,
    "blackbox_pack_isolation_evidence": null,
    "deleted_paths_applied": null,
    "repo_suite_junit_sha256": null,
    "repo_suite_passed": null,
    "repo_suite_started": null,
    "repo_suite_completed": null,
    "repo_suite_state": null,
    "repo_suite_image_digest": null,
    "base_sha": null,
    "head_sha": null,
    "base_tree_sha": null,
    "head_tree_sha": null,
    "policy_id": null,
    "policy_version": null,
    "execution_state": "completed",
    "execution_phase": "repo_suite",
    "test_command_started": true,
    "delivered_isolation": "subprocess",
    "effective_candidate_isolation": "subprocess",
    "candidate_invocations": null,
    "candidate_launcher_invocation_observed": null,
    "verifier_pack_present": false,
    "verifier_pack_started": false,
    "verifier_pack_completed": false,
    "setup_isolation": null,
    "runtime_tree_sha256": null,
    "runtime_tree_digest_format": null,
    "runtime_tree_entries": null,
    "runtime_tree_bytes": null,
    "runtime_identity_elapsed_ms": 0.0,
    "runtime_continuity": "not_applicable"
  },
  "diagnostics": "................................................................ [ 46%]\n........................................................................ [ 98%]\n..                                                                       [100%]\n138 passed, 8 subtests passed in 1.23s\n\n"
}