{
  "schema_version": "1.11",
  "tool": "evoguard",
  "tool_version": "3.5.1",
  "verdict": "REJECTED",
  "passed": false,
  "exit_code": 1,
  "reason_code": "protected_harness_edit",
  "reason": "reward-hack guard: the patch edits or deletes the judging tests, their configuration, the gate's CI/config, or an auto-executed file \u2014 fix the source under test, not the harness (tests/test_eq_regression.py)",
  "files_changed": [
    "tests/test_eq_regression.py"
  ],
  "protected_violations": [
    "tests/test_eq_regression.py"
  ],
  "risk_level": "high",
  "risk_score": 0.343,
  "tests_passed": null,
  "tests_total": null,
  "test_command_ran": false,
  "execution_state": "static_gate",
  "execution_phase": "pre_gate",
  "verdict_source": null,
  "isolation": "not_run",
  "source": "edit blocks",
  "base_reconstruction": null,
  "assurance": {
    "execution_state": "static_gate",
    "execution_phase": "pre_gate",
    "harness_integrity": "pre_gate_enforced",
    "report_integrity": "not_applicable_static_gate",
    "candidate_isolation": "not_run",
    "suite_isolation": "not_run",
    "setup_isolation": null,
    "runtime_continuity": "not_applicable",
    "verifier_pack": null,
    "overall_profile": "static_gate",
    "note": "the diff pre-gate decided this result before candidate execution; no test command, runtime boundary, report channel, setup, or verifier pack was exercised. Requested runtime policy is recorded only in attestation.effective_policy."
  },
  "diff_coverage": null,
  "baseline": null,
  "attestation": {
    "created_utc": "2026-07-14T16:49:13Z",
    "guard_version": "3.5.1",
    "mode": "repo",
    "candidate_sha256": "9652dcdc6043f1305256892a6bce1d3912b615e265674f3f9aa6bd1d2116f999",
    "deleted_paths": [],
    "test_command": [
      "python",
      "-m",
      "pytest",
      "tests",
      "-q",
      "-o",
      "addopts=",
      "-p",
      "no:cacheprovider"
    ],
    "effective_policy": {
      "mode": "repo",
      "isolation": "subprocess",
      "docker_image": null,
      "docker_network": "none",
      "test_command": [
        "python",
        "-m",
        "pytest",
        "tests",
        "-q",
        "-o",
        "addopts=",
        "-p",
        "no:cacheprovider"
      ],
      "setup_command": null,
      "trust_setup_on_host": false,
      "setup_output_globs": [],
      "protected": [],
      "allow": [],
      "allow_new_tests": false,
      "timeout": 600,
      "mem_limit_mb": 1024,
      "verifier_pack_required": false,
      "expect_verifier_pack_sha256": null,
      "blackbox": false,
      "blackbox_only": false,
      "require_report_integrity": null,
      "require_candidate_isolation": null,
      "min_diff_coverage": null,
      "baseline_evidence": true,
      "require_demonstrated_fix": true,
      "policy_id": null,
      "policy_version": null
    },
    "policy_sha256": "349c2c0d8da098341f914c043722cf438116ae05f003b35b9edebe50519419a9",
    "junit_sha256": null,
    "junit_digest_format": null,
    "verifier_pack_sha256": null,
    "verifier_pack_manifest": null,
    "verifier_pack_tests_passed": null,
    "verifier_pack_tests_total": null,
    "verifier_pack_digest_format": null,
    "isolation_evidence": null,
    "setup_isolation_evidence": null,
    "repo_suite_isolation_evidence": null,
    "verifier_pack_isolation_evidence": null,
    "blackbox_pack_isolation_evidence": null,
    "deleted_paths_applied": null,
    "repo_suite_junit_sha256": null,
    "repo_suite_passed": null,
    "repo_suite_started": null,
    "repo_suite_completed": null,
    "repo_suite_state": null,
    "repo_suite_image_digest": null,
    "base_sha": null,
    "head_sha": null,
    "base_tree_sha": null,
    "head_tree_sha": null,
    "policy_id": null,
    "policy_version": null,
    "execution_state": "static_gate",
    "execution_phase": "pre_gate",
    "test_command_started": false,
    "delivered_isolation": "not_run",
    "effective_candidate_isolation": "not_run",
    "candidate_invocations": null,
    "candidate_launcher_invocation_observed": null,
    "verifier_pack_present": null,
    "verifier_pack_started": null,
    "verifier_pack_completed": null,
    "setup_isolation": null,
    "runtime_tree_sha256": null,
    "runtime_tree_digest_format": null,
    "runtime_tree_entries": null,
    "runtime_tree_bytes": null,
    "runtime_identity_elapsed_ms": null,
    "runtime_continuity": null
  },
  "diagnostics": ""
}